{
  "schema_version": "2.0.0",
  "territory_key": "west-bank",
  "migrated_from": [
    "P1_West_Bank_12of12.json",
    "P2_الضفة_الغربية_12of12.json"
  ],
  "actors": [
    {
      "id": "actor:international-court-of-justice-icj",
      "name": "International Court of Justice (ICJ)",
      "actor_type": "judicial_body",
      "jurisdiction": "data not available",
      "notes": ""
    },
    {
      "id": "actor:israel-state",
      "name": "Israel",
      "actor_type": "state",
      "jurisdiction": "data not available",
      "notes": ""
    },
    {
      "id": "actor:israel-supreme-court-bagatz",
      "name": "Israel Supreme Court (Bagatz)",
      "actor_type": "judicial_body",
      "jurisdiction": "data not available",
      "notes": ""
    },
    {
      "id": "actor:israeli-settlers-in-west-bank",
      "name": "Israeli settlers in West Bank",
      "actor_type": "unattributed",
      "jurisdiction": "data not available",
      "notes": ""
    },
    {
      "id": "actor:knesset-israeli-parliament",
      "name": "Knesset (Israeli Parliament)",
      "actor_type": "unattributed",
      "jurisdiction": "data not available",
      "notes": ""
    },
    {
      "id": "actor:palestinians-in-the-west-bank",
      "name": "Palestinians in the West Bank",
      "actor_type": "unattributed",
      "jurisdiction": "data not available",
      "notes": ""
    },
    {
      "id": "actor:unclassified-4467",
      "name": "السلطة الوطنية الفلسطينية / دائرة الأراضي / سلطة المياه / الجهاز المركزي للإحصاء",
      "actor_type": "sub_state_authority",
      "jurisdiction": "data not available",
      "notes": ""
    },
    {
      "id": "actor:unclassified-5672",
      "name": "محكمة العدل الدولية / الأمم المتحدة",
      "actor_type": "judicial_body",
      "jurisdiction": "data not available",
      "notes": ""
    },
    {
      "id": "actor:unclassified-8046",
      "name": "محكمة العدل الدولية",
      "actor_type": "judicial_body",
      "jurisdiction": "data not available",
      "notes": ""
    }
  ],
  "perspectives": [
    {
      "id": "perspective:west-bank:state-of-israel-civil-administration",
      "territory": "west-bank",
      "represented_actor": "actor:israel-state",
      "label": "State of Israel / Civil Administration",
      "research_language": "he",
      "source_language_reason": "Primary documentary language of the represented institution",
      "years_of_scope": "1967-2026",
      "original_text_preserved": false,
      "literal_translation": false,
      "contextual_translation": true
    },
    {
      "id": "perspective:west-bank:perspective-arabic",
      "territory": "west-bank",
      "represented_actor": "actor:unclassified-4467",
      "label": "السلطة الوطنية الفلسطينية / دائرة الأراضي / سلطة المياه / الجهاز المركزي للإحصاء",
      "research_language": "ar",
      "source_language_reason": "Primary documentary language of the represented institution",
      "years_of_scope": "1948-2026",
      "original_text_preserved": false,
      "literal_translation": false,
      "contextual_translation": true
    }
  ],
  "claims": [
    {
      "id": "claim:west-bank:separation-barrier-geder-hahafrada-security-fence:justification",
      "territory": "west-bank",
      "perspective": "perspective:west-bank:state-of-israel-civil-administration",
      "subject": "physical_barrier:west-bank:separation-barrier-geder-hahafrada-security-fence",
      "claim_type": "justification",
      "text": "Israel states the barrier is necessary to protect Israeli civilians from Palestinian terrorism, particularly suicide bombings which increased significantly during the Second Intifada. From the beginning of the Second Intifada until July 2003, 73 Palestinian suicide bombings from the West Bank killed 293 Israelis and injured over 1,900. During the 11 months after the first continuous segment was built, only 3 suicide attacks succeeded; the number of attacks declined by over 90%. Israel also cites the need to provide air defense, with enemy aircraft able to cross from the Jordan River to the Mediterranean in three minutes.[citation:7][citation:11]",
      "sources": [
        "source:west-bank:wikipedia",
        "source:west-bank:israeli-supreme-court-rulings",
        "source:west-bank:international-court-of-justice-advisory-opinion-2004"
      ],
      "status": "documented"
    },
    {
      "id": "claim:west-bank:separation-barrier-geder-hahafrada-security-fence:characterization",
      "territory": "west-bank",
      "perspective": "perspective:west-bank:state-of-israel-civil-administration",
      "subject": "physical_barrier:west-bank:separation-barrier-geder-hahafrada-security-fence",
      "claim_type": "characterization",
      "text": "Opponents argue the barrier's route deviates substantially from the Green Line, is an illegal attempt to annex Palestinian land under the guise of security, violates international law, preempts final status negotiations, and severely restricts Palestinian movement and access to work. The International Court of Justice ruled in 2004 that the construction of the wall and its associated regime are contrary to international law.[citation:11]",
      "sources": [
        "source:west-bank:wikipedia",
        "source:west-bank:israeli-supreme-court-rulings",
        "source:west-bank:international-court-of-justice-advisory-opinion-2004"
      ],
      "status": "documented"
    },
    {
      "id": "claim:west-bank:eastern-border-security-barrier-israel-jordan-border:justification",
      "territory": "west-bank",
      "perspective": "perspective:west-bank:state-of-israel-civil-administration",
      "subject": "physical_barrier:west-bank:eastern-border-security-barrier-israel-jordan-border",
      "claim_type": "justification",
      "text": "Israel's longest and most porous border; used for weapons smuggling from Iran and its proxies to Palestinian terrorist groups in the West Bank. Since 2020, Israeli and Jordanian authorities intercepted more than 1,000 firearms; however, many still cross successfully. In October 2024, two Jordanians crossed and attacked Israeli soldiers.[citation:4]",
      "sources": [
        "source:west-bank:foundation-for-defense-of-democracies-fdd"
      ],
      "status": "documented"
    },
    {
      "id": "claim:west-bank:eastern-border-security-barrier-israel-jordan-border:characterization",
      "territory": "west-bank",
      "perspective": "perspective:west-bank:state-of-israel-civil-administration",
      "subject": "physical_barrier:west-bank:eastern-border-security-barrier-israel-jordan-border",
      "claim_type": "characterization",
      "text": "Palestinian sources likely characterize this as further territorial separation and collective punishment; also strains Israeli-Jordanian relations despite security cooperation.[citation:4]",
      "sources": [
        "source:west-bank:foundation-for-defense-of-democracies-fdd"
      ],
      "status": "documented"
    },
    {
      "id": "claim:west-bank:water-resource-appropriation-and-discrimination:justification",
      "territory": "west-bank",
      "perspective": "perspective:west-bank:state-of-israel-civil-administration",
      "subject": "incident:west-bank:water-resource-appropriation-and-discrimination",
      "claim_type": "justification",
      "text": "Israel states it has responded to Palestinian needs and increased water quantities provided beyond the Interim Agreement specifications; however, 60% of water provided is sold to Palestinians at inflated prices[citation:5]",
      "sources": [
        "source:west-bank:ecomena",
        "source:west-bank:business-human-rights-resource-centre"
      ],
      "status": "documented"
    },
    {
      "id": "claim:west-bank:water-resource-appropriation-and-discrimination:characterization",
      "territory": "west-bank",
      "perspective": "perspective:west-bank:state-of-israel-civil-administration",
      "subject": "incident:west-bank:water-resource-appropriation-and-discrimination",
      "claim_type": "characterization",
      "text": "Palestinian sources report discriminatory distribution: Israel uses 85% of water from West Bank aquifers, Palestinians receive 15%. Per capita use in Israel is 3.5 times higher than in the West Bank. Under international law, expropriating water from occupied territories for use by Israeli citizens is illegal.[citation:5]",
      "sources": [
        "source:west-bank:ecomena",
        "source:west-bank:business-human-rights-resource-centre"
      ],
      "status": "documented"
    },
    {
      "id": "claim:west-bank:settlement-expansion-and-land-confiscation:justification",
      "territory": "west-bank",
      "perspective": "perspective:west-bank:state-of-israel-civil-administration",
      "subject": "incident:west-bank:settlement-expansion-and-land-confiscation",
      "claim_type": "justification",
      "text": "Israel advances settlement construction for civilian and security purposes; the Civil Administration views Area C as serving Israeli needs including military training, economic interests, and settlement development[citation:1]",
      "sources": [
        "source:west-bank:b-tselem",
        "source:west-bank:jns-org",
        "source:west-bank:ava-press",
        "source:west-bank:the-national"
      ],
      "status": "documented"
    },
    {
      "id": "claim:west-bank:settlement-expansion-and-land-confiscation:characterization",
      "territory": "west-bank",
      "perspective": "perspective:west-bank:state-of-israel-civil-administration",
      "subject": "incident:west-bank:settlement-expansion-and-land-confiscation",
      "claim_type": "characterization",